clinic,rating,review,evidence_quote,primary_label,secondary_labels,patient_stage,automation_tier,product_surface,root_cause,severity,commercial_relevance
Create Fertility - St. Paul's,2,"Hello Luca,  We're sorry to hear you've ben unhappy with your experience with us. Our team aim to provide quality communication and care to all patients and we apologise if you felt this was not the case for you. We're like to reassure you that members of our team are investigating the circumstances",sorry to hear you've been unhappy,complaint_handling,,complaint,human_assisted,complaint_triage_monitor,no response SLA,3,3
Create Fertility - St. Paul's,3,Finally someone doing the job. Than the first confusions.Anyway I got appointment and all the explanation was clear to me so let's see what the program will be. The Dr was calm and clear  and explained everything to us and what step we suppose to take.,Than the first confusions,treatment_coordination,,treatment,human_assisted,patient_pathway_coordinator,no proactive update,3,3
Avenues,1,"The entire process has been unnecessarily stressful due to a lack of transparency in communication and an inability to address straightforward requests. Additionally, the use of overly casual language, such as ending sensitive emails/messages with 'kisses,' feels inappropriate and unprofessional giv",lack of transparency in communication,complaint_handling,,complaint,workflow_solvable,complaint_triage_monitor,lack of transparency,3,4
"The Birth Company London, HCA",1,"Dear Ananda,   Thank you for taking the time to feedback to us. We are disappointed that we did not meet your expectations. We have contacted you directly and investigated your case. Whilst we strive to learn and improve, we cannot identify any error made on behalf of The Birth Company team on this",We cannot identify any error made on behalf of The Birth Company team.,complaint_handling,,complaint,human_assisted,complaint_triage_monitor,stonewalled,3,4
"The Birth Company London, HCA",2,"I went for a Harmony test at exactly 10 weeks. Almost a week later I received a call saying that my results were inconclusive and they need to repeat the test. Went to give another sample, had another scan just to receive again the same no …",Almost a week later I received a call saying that my results were inconclusive.,results_delivery,treatment_coordination,treatment,workflow_solvable,patient_pathway_coordinator,no proactive update,3,3
London Gynaecology - Moorgate,1,"Really disappointed with my experience here. Poor customer service and lack of transparency on pricing. When you pay a premium for a service, I would have expected better.",Lack of transparency on pricing.,financial_transparency,,pre_visit,workflow_solvable,financial_consent_flow,no pricing transparency,3,4
London Gynaecology - Moorgate,3,"The receptionist and nurses were very nice. However, the doctor seems to be busy, she was pausing and checking her schedule/ next appointment, and also she forgot to do my smear test which I have specified in my booking request. Disappointed by the experience given it’s private, but you got an NHS e",forgot to do my smear test,treatment_coordination,appointment_management,treatment,human_assisted,patient_pathway_coordinator,no protocol adherence,3,3
London Gynaecology - Harley Street,2,"I came in for a pap smear and the doctor who attended me seemed like she wanted to be anywhere else but there and rushed the entire thing. Additionally, I received a 1 minute call a week later informing me of my results, which I was never …",received a 1 minute call a week later,results_delivery,not_automatable,post_treatment,workflow_solvable,patient_pathway_coordinator,no proactive update,3,3
The Fertility Academy,1,"I initially contacted The Fertility & Gynaecology Academy due to a misunderstanding with the contact information I found online. Despite this mix-up, the admin staff was eager to assist, strongly recommending Dr. Amin Gorgy as an exceptional option. Encouraged by their enthusiasm, and after discussi",appointment began later than planned,appointment_management,not_automatable,consultation,workflow_solvable,booking_ops_layer,no time management,3,3
The Fertility Academy,1,Extremely poor service. First I called and ask if I can book an appointment for test and I was told “yes” and the receptionist book me for the test and even made me pay a deposit. After one hour she called me back saying she  did a mistake and first I need to have a consultation and then the test...,she did a mistake and first I need to have a consultation,appointment_management,financial_transparency,booking,workflow_solvable,booking_ops_layer,no response SLA,3,4
The Fertility Academy,1,"I cannot unfortunately recommend this place. Dr Gorgy charged us £230 for a consultation, which resulted only in him providing the complete pricelist for his services, none of our history was analysed, and no specific or useful recommendations were made - instead just a recommendation that we try a",Dr Gorgy charged us £230 for a consultation,pre_visit_information,financial_transparency,consultation,human_assisted,financial_consent_flow,no ownership,3,4
Miss Claire Mellon & Associates,1,I would not go back - shallow approach .. fees that exceed any insurance premium for no reason .. silly chats To top up the second consultation is over the phone max on 2 min charged at the rate of £250 Give us a break,fees that exceed any insurance premium,financial_transparency,,billing,workflow_solvable,financial_consent_flow,no ownership,3,4
Miss Claire Mellon & Associates,2,"Appointments cancelled at short notice, poor appointment availability, particularly if you’re working full time, and curt staff. Would not recommend.",Appointments cancelled at short notice,appointment_management,inbound_access,booking,workflow_solvable,booking_ops_layer,no response SLA,3,3
Harley Street Gynaecology,1,"I’m extremely disappointed with the level of customer service I’ve received from 25 Harley Street Gynaecology Clinic. When you’re paying Harley Street prices, you expect a standard of service that reflects that – unfortunately, that’s far from what I experienced.  While Dr. Khan was lovely and profe",The secretary’s communication is poor,admin_records,inbound_access,treatment,workflow_solvable,booking_ops_layer,no ownership,3,3
The Lister Fertility Clinic,1,"I'm doing something I don't usually do, write a review without using the service. This clinic was one of the 3 clinics that my private health insurance authorised, so it was my preferred one, but they just don't answer the phone, it's …",they just don't answer the phone,inbound_access,,enquiry,bot_solvable,inbound_manager,unanswered phone calls,3,4
The Lister Fertility Clinic,1,"This clinic is actually awful. I went in for a general check-up. I have private insurance and provided my authorization code at the appointment, and they assured me all was fine. Since then, I’ve been receiving letters claiming I have an …",receiving letters claiming I have an,admin_records,financial_transparency,billing,workflow_solvable,financial_consent_flow,billing errors,3,4
The Lister Fertility Clinic,1,Extremely disappointed right at the beginning of my egg donation process. The treatment I received in this place is appalling. Went in for my blood tests and was treated very poorly by the phlebotomist. Very rude staff that make you feel like you are bothering them when asking questions or explanati,sent the wrong forms previous to my appointment,complaint_handling,admin_records,pre_visit,workflow_solvable,complaint_triage_monitor,blaming patient for errors,3,3
The Lister Fertility Clinic,1,"Limited information available online. When tried to schedule an appointment, after filling out a long form online, required to make a paypal payment before anyone contacted me or I could even understand when appointments are available or what the paypal charge is for?! Certainly seems to support the",required to make a paypal payment before anyone contacted me,pre_visit_information,financial_transparency,enquiry,bot_solvable,inbound_manager,unclear payment process,3,4
The Lister Fertility Clinic,2,"Questionable wait times at this clinic, especially given that women are paying thousands of pounds for a private treatment. 3 hours to see a nurse?? The whole industry seems to be completely unregulated and understaffed. On a more positive …",Questionable wait times at this clinic,appointment_management,treatment_coordination,consultation,workflow_solvable,booking_ops_layer,understaffed,3,3
The Evewell - West London,2,The staff were very friendly but unfortunately they didn’t deliver. We attended an initial screening appointment and a consultation. This was our first clinic we attended and the consultation didn’t address the main issue we had and didn’t …,didn’t address the main issue,treatment_coordination,,consultation,human_assisted,patient_pathway_coordinator,no issue resolution,3,3
The Evewell - West London,3,"Great clinicians and very pleased with the consultations I had. Sadly the patient support/ front office team let down the experience - had to chase for appointments, follow ups and to get my correct test results after submitting a data request for my medical records. I get the impression that if we’",chase for appointments,results_delivery,appointment_management,post_treatment,workflow_solvable,patient_pathway_coordinator,no proactive updates,3,3
London Women's Clinic - Harley Street,1,"I had a hugely disappointing experience at this clinic. I went in for a consultation and ultrasound in mid-January, where I was told I might have a suspected unicornuate uterus. I was reassured I could still proceed with egg freezing and …",told I might have a suspected unicornuate uterus,pre_visit_information,treatment_coordination,consultation,workflow_solvable,patient_pathway_coordinator,incomplete information,3,4
London Women's Clinic - Harley Street,1,Update:  I found the clinic through doing research and trusted them because of this and the fact that they are on Harley Street and you’d expect a better service from a clinic on “Harley street”  The biggest mistake I made was going to this clinic. On the initial consultation i told the nurse Georgi,only month I could do it,appointment_management,inbound_access,booking,workflow_solvable,booking_ops_layer,no scheduling flexibility,3,4
London Women's Clinic - Harley Street,1,"So far the communication from this place has been abysmal. Our coordinator Maria takes days to respond (if at all) and multiple chases are required to get an answer. Owing to her tardiness, we have likely missed the opportunity to start treatment this cycle meaning a whole month of delays. Further,",takes days to respond,inbound_access,appointment_management,enquiry,workflow_solvable,inbound_manager,no response SLA,3,5
London Women's Clinic - Harley Street,1,"Bad experience very expensive and dont bother to get back to you, you will constantly be chasing them. They do everything to get extra money instead of focusing on patient care. Cannot recommend I would suggest going with a smaller clinic for a more caring approach. We know see a lovely little clini",dont bother to get back to you,inbound_access,financial_transparency,enquiry,workflow_solvable,inbound_manager,no response SLA,3,5
London Women's Clinic - Harley Street,1,The initial process of getting the appointment and having the 1st appointment for myself and partner was fine staff was friendly everything was okay. Now on the day i was suppose get my consultation  i spoke to one of the doctors and i must …,on the day i was suppose get my consultation,appointment_management,,booking,workflow_solvable,booking_ops_layer,scheduling error,3,3
London Women's Clinic - Harley Street,1,I had one natural cycle of IUI at this clinic. The service here was awful: 1. Clinic does not open at weekends so if your cycle occurs then there is no chance to get pregnant! Oh sorry it opens till 12 on Saturday. still not ideal …,Clinic does not open at weekends,appointment_management,,booking,workflow_solvable,booking_ops_layer,limited clinic hours,3,3
London Women's Clinic - Harley Street,1,"The payment was so unclear. It was given by the nurse on a piece of paper and she kept adding and deleting costs so both of us got very confused. Although we paid £500 for the initial consultation/tests, I decided not to proceed with this …",The payment was so unclear,financial_transparency,,pre_visit,workflow_solvable,financial_consent_flow,unclear payment process,3,4
London Women's Clinic - Harley Street,1,Terrible customer service. Impossible to get in contact with. Called and emailed for 3 days after my wife's initial appointment but no response. Have booked elsewhere on Harley Street. Avoid. (Response to below comment: yes I am certain I have the correct clinic),Called and emailed for 3 days,inbound_access,,enquiry,bot_solvable,inbound_manager,no response SLA,3,5
London Women's Clinic - Harley Street,2,"Do not recommend.  I attended to begin egg freezing. When I wanted to start the treatment, I found …",wanted to start the treatment,appointment_management,,booking,workflow_solvable,booking_ops_layer,treatment start delay,3,4
London Women's Clinic - London Bridge,1,Avoid. I chose the clinic mainly based on location disregarding mixed reviews I came across while doing my research. DOB on the forms were incorrect and we were not able to update it ourselves. My husband asked reception to update DOB after his appointment. When I came for my appointment I was told,DOB on the forms were incorrect,admin_records,complaint_handling,booking,workflow_solvable,booking_ops_layer,data errors,3,3
London Women's Clinic - London Bridge,1,"Friendly enough but overall not a very professional establishment - everything always seems to be running late, they're not clear on what services they offer, etc.  Would suggest you look elsewhere.",everything always seems to be running late,appointment_management,pre_visit_information,booking,workflow_solvable,booking_ops_layer,no proactive update,3,4
Harley Street Fertility Clinic,1,"Poor communication.pricing most definitely inflated from website,process very complicated. We had all our test done,But decided to finish process off with ABC clinic.",pricing most definitely inflated from website,financial_transparency,pre_visit_information,pre_visit,workflow_solvable,financial_consent_flow,no pricing clarity,3,4
Harley Street Fertility Clinic,1,Avoid at all costs. Money hungry. Poor service.,Money hungry. Poor service.,financial_transparency,,billing,workflow_solvable,financial_consent_flow,no pricing transparency,3,4
Harley Street Fertility Clinic,1,Terrible communication,Terrible communication,inbound_access,,enquiry,bot_solvable,inbound_manager,no communication protocol,3,3
Harley Street Fertility Clinic,1,"We are very sorry to hear of your experience Jessica.  This is not the service we strive for and we wish to rectify your personal concerns. I understand that you have now spoken to Mustafa, our Operations and Quality Manager, and are … More",we wish to rectify your personal concerns,complaint_handling,,complaint,human_assisted,complaint_triage_monitor,no complaint resolution process,3,3
CRGH (The Centre for Reproductive and Genetic Health),1,"This review is of the finance department and not of the clinic itself, which we’ve had a generally good experience with - especially with Dr Cardenas, I can’t recommend her enough, and all the nursing, sonographers and other hands on staff, …",review is of the finance department,financial_transparency,,billing,workflow_solvable,financial_consent_flow,finance department issues,3,4
CRGH (The Centre for Reproductive and Genetic Health),1,"Rude…. I rang up as a new patient enquiry. I required a specific cost, I was told that no one in that department was currently available to answer that question at the moment. I asked if they could call me back with the cost. I was told no and asked to ring back in 20minutes. I politely said that I",no one in that department was currently available,inbound_access,financial_transparency,enquiry,bot_solvable,inbound_manager,no callback system,3,4
CRGH (The Centre for Reproductive and Genetic Health),1,"CAVEAT: I have not included my name as I wish for my treatment to be kept private - however I would be v happy for CRGH to leave a message should they wish to know my full name in order to prove that I was a genuine patient until recently, …",wish for my treatment to be kept private,complaint_handling,,complaint,human_assisted,complaint_triage_monitor,privacy concerns,3,3
CRGH (The Centre for Reproductive and Genetic Health),1,"Very expensive, not attentive, no one available to talk to.  We started to investigate with CRGH in Nov.2017. We had all the tests …",no one available to talk to,inbound_access,financial_transparency,enquiry,bot_solvable,inbound_manager,no response SLA,3,4
CRGH (The Centre for Reproductive and Genetic Health),1,EDIT TO ADD AS I'VE HAD A LOT OF MESSAGES ABOUT THIS REVIEW  Sadly CRGH never reached out to me again even after I emailed as …,never reached out to me,complaint_handling,,complaint,workflow_solvable,complaint_triage_monitor,no follow-up,3,3
CRGH (The Centre for Reproductive and Genetic Health),1,I wish I would have chosen another place from start. There are too many issues and it becomes really frustrating to manage the hassle with clinic while you are also going through a sensitive time so I would really recommend to try somewhere …,receptionist was very rude,inbound_access,complaint_handling,enquiry,bot_solvable,inbound_manager,no response SLA,3,4
CRGH (The Centre for Reproductive and Genetic Health),1,As lovely as the staff are I am posting this to forewarn hopeful parents to be- please explore all possible avenues before embarking on breathtakingly expensive ivf. We were told we had a very …,please explore all possible avenues before embarking on breathtakingly expensive ivf.,pre_visit_information,,pre_visit,bot_solvable,financial_consent_flow,lack of cost transparency,3,4
CRGH (The Centre for Reproductive and Genetic Health),1,APALLING SERVICE AVOID!!  Had to fill the same forms in multiple times as they always lost them. …,Had to fill the same forms in multiple times as they always lost them.,admin_records,,booking,workflow_solvable,booking_ops_layer,lost records,3,3
CRGH (The Centre for Reproductive and Genetic Health),1,Do you get paid to play smooth radio and alllllllllllll the upbeat classics to anxious people who have paid expensive fertility treatment in your waiting room for appointments that are over 50 minutes late.,appointments that are over 50 minutes late.,appointment_management,,booking,workflow_solvable,booking_ops_layer,delayed appointments,3,3
CRGH (The Centre for Reproductive and Genetic Health),1,"I chose CRGH for IVF treatment because of the clinic’s reputation for personalised treatment plans and experience with complex fertility cases. Having already undergone 6 egg collections and 3 embryo transfers abroad without success, I was …",personalised treatment plans,pre_visit_information,,pre_visit,human_assisted,patient_pathway_coordinator,no proactive update,3,4
CRGH (The Centre for Reproductive and Genetic Health),1,Thank you for taking the time to leave your feedback. We would like to discuss your experience further and invite you to contact us on feedback@crgh.co.uk,invite you to contact us on feedback,complaint_handling,,complaint,workflow_solvable,complaint_triage_monitor,no response SLA,3,3
CRGH (The Centre for Reproductive and Genetic Health),2,Double check the cost of everything and get it in writing if not provided automatically!! …,Double check the cost of everything,financial_transparency,,booking,bot_solvable,financial_consent_flow,no pricing transparency,3,5
CRGH (The Centre for Reproductive and Genetic Health),2,"I haven’t even started treatment yet, and I’m already seriously rethinking my choice. The clinic may have good medical reviews, but the communication and admin process have been extremely frustrating. …",communication and admin process have been extremely frustrating,inbound_access,,pre_enquiry,workflow_solvable,inbound_manager,no response SLA,3,5
CRGH (The Centre for Reproductive and Genetic Health),3,I am currently 8 day post transfer and today went to collect my prescription where the nurse had no idea about the quantity she should prescribe despite emailing and calling them yesterday to inform about the remaining medications which I …,nurse had no idea about the quantity,treatment_coordination,,treatment,workflow_solvable,patient_pathway_coordinator,no proactive update,3,4
CRGH (The Centre for Reproductive and Genetic Health),3,"I travelled a long way for the appointment (a simple blood test) and had to wait 40 minutes past my appointment time, no explanation or apology given. Hand hygiene was questionable. Disappointing.",had to wait 40 minutes past my appointment time,appointment_management,,consultation,workflow_solvable,booking_ops_layer,no proactive update,3,3
CRGH (The Centre for Reproductive and Genetic Health),3,"The doctors and nurses at this place are amazing, very knowledgeable and by all metrics, acheive great results in terms of supporting people with fertility and genetic issues. However, the administrative structure of CRGH leaves a lot to be desired. You never know who you are meant to talk to to get",You never know who you are meant to talk to,treatment_coordination,inbound_access,treatment,workflow_solvable,patient_pathway_coordinator,no ownership,3,4
CRGH (The Centre for Reproductive and Genetic Health),3,The doctors and nurses really care about their patients and will go above and beyond for you.  The finance team on the other hand are extremely aggressive and have no qualms whatsoever with issuing invoices at the eleventh hour and then …,issuing invoices at the eleventh hour,financial_transparency,,billing,workflow_solvable,financial_consent_flow,no pricing transparency,3,4
Fertility Plus,1,"Extremely poor customer service, Paid all bills on time instead of a proper due diligence they sent my account to debt collection agencies. I had to provide the payment confirmation which was made 6 months before they sent my account to debt collection. I would not recommend to use their service and",sent my account to debt collection,financial_transparency,admin_records,billing,workflow_solvable,financial_consent_flow,no payment reconciliation,3,4
Fertility Plus,1,"Went to start fertility treatment and even though asking how I could prepare, I was not recommended to go off my birth control. I paid 400£ and then had to go off birth control for 3 months and then come back again.",not recommended to go off my birth control,pre_visit_information,,pre_visit,bot_solvable,patient_pathway_coordinator,no preparation guidance,3,3
Fertility Plus,1,"well, I am just calling them to start IVF treatment. Nobody answers their phone. It must be a joke. off to a very good start, eh?  At this day and age, an establishment that doesn't answer their public phone has no sympathy from me. sorry.",Nobody answers their phone,inbound_access,,enquiry,bot_solvable,inbound_manager,no response SLA,3,4
Fertility Plus,1,"We are sorry to learn of the rating you gave the clinic.  We don't recognise your name perhaps you intended to leave this rating for another clinic?  We take great pride in our patient experience, especially as fertility treatment is often … More",We don't recognise your name,complaint_handling,,complaint,workflow_solvable,complaint_triage_monitor,stonewalling,3,4
Fertility Plus,2,"To be clear this review reflects my experience of trying to book, not the service. I have given up trying to book here because it feels like trying to gain access to a private club. Unfriendly service on the phone and over email, made to feel like I should be grateful that I am able to book with the",Unfriendly service on the phone,inbound_access,appointment_management,booking,workflow_solvable,booking_ops_layer,unfriendly service,3,4
King's Fertility,1,"I regret having to express my dissatisfaction with Kings Fertility. As a private patient, the client-facing and communication aspects of their service are notably very poor.  Despite assurances from the assessing Dr that a follow-up appointment would take 1-2 weeks at most - this was forgotten about",forgotten about and never offered,appointment_management,treatment_coordination,treatment,workflow_solvable,patient_pathway_coordinator,forgotten follow-up,3,4
King's Fertility,1,DO NOT GO TO THIS CLINIC ITS A SCAM!!!  I have booked an appointment through NHS and I have waiting for 4 months for …,I have waiting for 4 months for,appointment_management,inbound_access,booking,bot_solvable,booking_ops_layer,no confirmation,3,3
King's Fertility,1,"I was recommended to this clinic from a friend but I have been disappointed from the beginning. I initially contact them for fertility testing with a view to egg freezing and was excited that they could fit me in, were less expensive than other clinics, and were local to me. Unfortunately after I bo",received no confirmation email,appointment_management,inbound_access,booking,bot_solvable,booking_ops_layer,no confirmation,3,3
Aria Fertility,1,i had bad experience bad service i wouldn't recommend this fertility place. they can not keep track of client's payments. doctors were very negative.,they can not keep track of client's payments,financial_transparency,complaint_handling,billing,workflow_solvable,financial_consent_flow,payment tracking failure,3,5
